<config xmlns="http://www.121media.com/xsd/ProxyTestConfig"
        xmlns:xsi="http://www.w3.org/2001/XMLSchema-instance" 
        xsi:schemaLocation="http://www.121media.com/xsd/ProxyTestConfig ./ProxyTestConfig.xsd">

  <execution_time>1800</execution_time>
  <threads_number>300</threads_number>
  <request_max_delay>1000000</request_max_delay>

  <statistics metering_dump="1000" per_url_stat="true"/>

  <request_constraints 
    sampling_size="10000"
    timeout="3000000"
    intended_time="2000000"
    failed_percentage="100"
    prolonged_percentage="100" />

  <url_list_file>@site_config_root@/tests/SearchFrontend/Requests.txt</url_list_file>

  <request>
    <scheduling>
      <stick_frequency period="40000" 
      />

<!--
                       decrease_by="5000"
                       decrease_to="1000"
                       decrease_every="10"
-->

    </scheduling>

    <headers>
      <header name="Accept-Encoding" value="gzip,deflate"/>
<!--
      <header name="Accept-Language" value="en-us"/>
      <header name="User-Agent" value="Mozilla/4.0 (compatible; MSIE 6.0; Windows NT 5.1; SV1; .NET CLR 1.1.4322)"/>
-->
    </headers>

  </request>

</config>
